[
  {
    "anchor_id": "anc_00001",
    "page": 1,
    "section": "Metadata",
    "bbox": null,
    "text_span": "SUN database: Large-scale scene recognition from abbey to zoo",
    "source_type": "paragraph"
  },
  {
    "anchor_id": "anc_00002",
    "page": 1,
    "section": "Metadata",
    "bbox": null,
    "text_span": "Jianxiong Xiao, James Hays, Krista A. Ehinger, A. Oliva, A. Torralba",
    "source_type": "paragraph"
  },
  {
    "anchor_id": "anc_00003",
    "page": 1,
    "section": "Metadata",
    "bbox": null,
    "text_span": "Year: 2010; venue: 2010 IEEE Computer Society Conference on Computer Vision and Pattern Recognition; paper type: Computer Vision / Pose Estimation / Computer Vision / Top-cited Computer Vision paper.",
    "source_type": "paragraph"
  },
  {
    "anchor_id": "anc_00004",
    "page": 1,
    "section": "Abstract",
    "bbox": null,
    "text_span": "Scene categorization is a fundamental problem in computer vision. However, scene understanding research has been constrained by the limited scope of currently-used databases which do not capture the full variety of scene categories. Whereas standard databases for object categorization contain hundreds of different classes of objects, the largest available dataset of scene categories contains only 15 classes. In this paper we propose the extensive Scene UNderstanding (SUN) database that contains 899 categories and 130,519 images. We use 397 well-sampled categories to evaluate numerous state-of-the-art algorithms for scene recognition and establish new bounds of performance. We measure human scene classification performance on the SUN database and compare this with computational methods. Additionally, we study a finer-grained scene representation to detect scenes embedded inside of larger scenes.",
    "source_type": "paragraph"
  },
  {
    "anchor_id": "anc_00005",
    "page": 1,
    "section": "Source Availability",
    "bbox": null,
    "text_span": "PDF download was unavailable for this benchmark run. This fallback source contains only paper metadata and the abstract from the selection index. Full-text formulas, tables, figures, ablations, and implementation details must be treated as unknown unless they appear here.",
    "source_type": "paragraph"
  }
]