[
  {
    "anchor_id": "anc_00001",
    "page": 1,
    "section": "Metadata",
    "bbox": null,
    "text_span": "Locality-constrained Linear Coding for image classification",
    "source_type": "paragraph"
  },
  {
    "anchor_id": "anc_00002",
    "page": 1,
    "section": "Metadata",
    "bbox": null,
    "text_span": "Jinjun Wang, Jianchao Yang, Kai Yu, Fengjun Lv, Thomas S. Huang, Yihong Gong",
    "source_type": "paragraph"
  },
  {
    "anchor_id": "anc_00003",
    "page": 1,
    "section": "Metadata",
    "bbox": null,
    "text_span": "Year: 2010; venue: 2010 IEEE Computer Society Conference on Computer Vision and Pattern Recognition; paper type: Computer Vision / Top-cited Computer Vision paper.",
    "source_type": "paragraph"
  },
  {
    "anchor_id": "anc_00004",
    "page": 1,
    "section": "Abstract",
    "bbox": null,
    "text_span": "unknown",
    "source_type": "paragraph"
  },
  {
    "anchor_id": "anc_00005",
    "page": 1,
    "section": "Source Availability",
    "bbox": null,
    "text_span": "PDF download was unavailable for this benchmark run. This fallback source contains only paper metadata and the abstract from the selection index. Full-text formulas, tables, figures, ablations, and implementation details must be treated as unknown unless they appear here.",
    "source_type": "paragraph"
  }
]